{
  "schemaVersion": "v0.1",
  "kind": "LocalModelProfile",
  "profileId": "urn:srcos:model-profile:local-llama32-3b",
  "displayName": "Local Llama 3.2 3B Quality Fallback",
  "runtime": {
    "kind": "ollama",
    "endpoint": "http://127.0.0.1:11434",
    "defaultLocalPort": 11434,
    "launchCommand": "ollama run llama3.2:3b",
    "healthCommand": "ollama list"
  },
  "model": {
    "provider": "Meta",
    "family": "Llama 3.2",
    "name": "llama3.2:3b",
    "parameterClass": "3b",
    "ollamaRef": "llama3.2:3b",
    "ggufRef": null,
    "contextWindowHint": 128000,
    "diskSizeHintMb": 2048,
    "memoryHintMb": 8192,
    "licenseRef": "https://www.llama.com/llama3_2/license/",
    "sourceRef": "https://ollama.com/library/llama3.2"
  },
  "roles": [
    "summarization",
    "rewrite",
    "office-assist",
    "agent-machine-assist",
    "offline-fallback",
    "coding-assist",
    "privacy-first-chat"
  ],
  "policy": {
    "localOnlyDefault": true,
    "sendPromptOffDeviceDefault": false,
    "allowToolUse": false,
    "allowNetwork": false,
    "allowModelDownload": false,
    "requiresExplicitPull": true,
    "maxPromptChars": 24000,
    "fallbackProfileRefs": [
      "urn:srcos:model-profile:local-llama32-1b"
    ]
  },
  "evidence": {
    "emitModelAvailability": true,
    "emitRuntimeHealth": true,
    "emitRoutingDecision": true,
    "emitPromptHashOnly": true
  },
  "notes": "Quality fallback local model profile for machines that can afford a slightly larger model. Still local-only by default and does not authorize tool use or network access."
}
